{
  "challenge_id": "r1-s01-model-client-servidor-stack",
  "student": "batoi-dwes-2026/microreptes-fakeigomis",
  "commit": "4dc614b3a4bbadb34986fdcdf152c5ddba44e165",
  "final_score_over_10": 7.8,
  "ra_scores": [
    {
      "ra_id": "RA1",
      "score": 7.8,
      "assessed_ca": [
        "RA1.a",
        "RA1.b",
        "RA1.c",
        "RA1.g"
      ],
      "reason": "Nota simulada per a RA1 a partir dels criteris declarats del microrepte."
    }
  ],
  "provisional": true,
  "dimension_scores": [
    {
      "id": "functional_resolution",
      "score": 2.87,
      "max_score": 3.5,
      "reason": "Valor simulat a partir de la rubrica: La fitxa resol el model client/servidor del producte i formula una decisió tècnica orientativa coherent."
    },
    {
      "id": "verification",
      "score": 1.48,
      "max_score": 2,
      "reason": "Valor simulat a partir de la rubrica: Inclou evidència revisable de la fitxa, fonts o contrast utilitzat, i punts que es poden defensar oralment."
    },
    {
      "id": "traceability",
      "score": 0.82,
      "max_score": 1,
      "reason": "Valor simulat a partir de la rubrica: Els documents i decisions del microrepte són localitzables al repositori i no queden només en converses externes."
    },
    {
      "id": "documentation",
      "score": 1.11,
      "max_score": 1.5,
      "reason": "Valor simulat a partir de la rubrica: README.md o la documentació enllaça la fitxa, resumeix la decisió i deixa clars els dubtes oberts."
    },
    {
      "id": "ai_usage",
      "score": 0.41,
      "max_score": 0.5,
      "reason": "Valor simulat a partir de la rubrica: Si usa IA, el resultat mostra contrast i comprensió pròpia; les captures o respostes d'IA no substitueixen la fitxa."
    },
    {
      "id": "code_quality",
      "score": 1.11,
      "max_score": 1.5,
      "reason": "Valor simulat a partir de la rubrica: La comparació de tecnologies és acotada, realista, orientada a R1M2 i deixa clar que el framework complet queda per a R3 o més avant."
    }
  ],
  "strengths": [
    "Payload d_avaluacio llegit correctament.",
    "La rubrica permet generar una estimacio inicial coherent."
  ],
  "weaknesses": [
    "Resultat simulat: encara no revisa codi real ni executa proves del repositori de l_alumne."
  ],
  "blocking_flags": [],
  "teacher_review_required": false,
  "confidence": 0.78,
  "short_feedback_md": "### Feedback provisional\n\nAutograding simulat sense OpenAI. La qualificacio es basa en les dimensions de la rubrica i ha de ser revisada abans de considerar-la definitiva."
}
